<?xml version="1.0" encoding="UTF-8"?>
<!DOCTYPE zion SYSTEM "..//IComponent.dtd">

<icomponent>
	<config>
		<entry key="author" type="STRING" value="Istvan Fehervari" />
		<entry key="version" type="STRING" value="1.00" />
		<entry key="classdir" type="STRING" value="XOR/XOR" />
		<entry key="classname" type="STRING" value="XOR.XOR" />
		<entry key="name" type="STRING" value="XOR" />
		<entry key="description" type="STRING"
			value="A simple XOR problem to test evolutionary algorithms if they work properly. Fitness is determined by the mean square error." />
		<entry key="image" type="STRING" value="xor.png" />
		<entry key="tags" type="STRING" value="XOR TAG" />
	</config>
	<properties>
	</properties>
	<requirements>
		<reqentry key="inputnumber" type="INT" value="2" />
		<reqentry key="outputnumber" type="INT" value="1" />
		<reqentry key="minimumCandidates" type="INT" value="1" />
		<reqentry key="maximumCandidates" type="INT" value="1" />
	</requirements>
</icomponent>
